{
  "schema": "wi.arc.rule_catalog/v1",
  "program": "WI8-ARC",
  "count": 120,
  "carried_forward_count": 60,
  "new_count": 60,
  "merger_rule": "Keep B rules in earlier package as implementation owner; names here are registry references, not a second implementation.",
  "requirements": [
    {
      "id": "B001",
      "number": 1,
      "title": "Metaphor Saturation Governor",
      "domain": "Prose Intelligence",
      "normative_text": "Detect excessive similes, metaphors, and poetic interpretations across passages; recommend selective edits without flattening voice.",
      "origin": "carried_forward_prior_zip",
      "implementation": "existing_separate_zip_not_imported",
      "evidence_kind": "authored_specification",
      "canonical_owner": "existing_craft_and_storyworld",
      "acceptance": "Record typed causal evidence and falsifiable negative control for metaphor saturation governor.",
      "human_boundary": "Never claim literary merit or reader response from structural conformance alone."
    },
    {
      "id": "B002",
      "number": 2,
      "title": "Figurative Language Value Test",
      "domain": "Prose Intelligence",
      "normative_text": "Require major imagery to add perception, emotional consequence, characterization, or thematic meaning rather than paraphrase the previous line.",
      "origin": "carried_forward_prior_zip",
      "implementation": "existing_separate_zip_not_imported",
      "evidence_kind": "authored_specification",
      "canonical_owner": "existing_craft_and_storyworld",
      "acceptance": "Record typed causal evidence and falsifiable negative control for figurative language value test.",
      "human_boundary": "Never claim literary merit or reader response from structural conformance alone."
    },
    {
      "id": "B003",
      "number": 3,
      "title": "Manuscript-Wide Repetition Detection",
      "domain": "Prose Intelligence",
      "normative_text": "Count repetitive expressions and sentence patterns by chapter and across the complete manuscript, reporting locations rather than guessing quality.",
      "origin": "carried_forward_prior_zip",
      "implementation": "existing_separate_zip_not_imported",
      "evidence_kind": "authored_specification",
      "canonical_owner": "existing_craft_and_storyworld",
      "acceptance": "Record typed causal evidence and falsifiable negative control for manuscript-wide repetition detection.",
      "human_boundary": "Never claim literary merit or reader response from structural conformance alone."
    },
    {
      "id": "B004",
      "number": 4,
      "title": "Metaphor Family Registry",
      "domain": "Prose Intelligence",
      "normative_text": "Distinguish deliberately recurrent imagery from overused image families and semantic equivalents.",
      "origin": "carried_forward_prior_zip",
      "implementation": "existing_separate_zip_not_imported",
      "evidence_kind": "authored_specification",
      "canonical_owner": "existing_craft_and_storyworld",
      "acceptance": "Record typed causal evidence and falsifiable negative control for metaphor family registry.",
      "human_boundary": "Never claim literary merit or reader response from structural conformance alone."
    },
    {
      "id": "B005",
      "number": 5,
      "title": "Plain Prose Counterweight",
      "domain": "Prose Intelligence",
      "normative_text": "Protect direct physical description, ordinary sentences, and restraint as deliberate parts of literary rhythm.",
      "origin": "carried_forward_prior_zip",
      "implementation": "existing_separate_zip_not_imported",
      "evidence_kind": "authored_specification",
      "canonical_owner": "existing_craft_and_storyworld",
      "acceptance": "Record typed causal evidence and falsifiable negative control for plain prose counterweight.",
      "human_boundary": "Never claim literary merit or reader response from structural conformance alone."
    },
    {
      "id": "B006",
      "number": 6,
      "title": "Narrative Overexplanation Detector",
      "domain": "Prose Intelligence",
      "normative_text": "Flag passages where exposition names the meaning of an already intelligible dramatic image.",
      "origin": "carried_forward_prior_zip",
      "implementation": "existing_separate_zip_not_imported",
      "evidence_kind": "authored_specification",
      "canonical_owner": "existing_craft_and_storyworld",
      "acceptance": "Record typed causal evidence and falsifiable negative control for narrative overexplanation detector.",
      "human_boundary": "Never claim literary merit or reader response from structural conformance alone."
    },
    {
      "id": "B007",
      "number": 7,
      "title": "Emotional Declaration Restraint",
      "domain": "Prose Intelligence",
      "normative_text": "Find repeated statements of emotion that could be carried more effectively by action, dialogue, thought, or consequence.",
      "origin": "carried_forward_prior_zip",
      "implementation": "existing_separate_zip_not_imported",
      "evidence_kind": "authored_specification",
      "canonical_owner": "existing_craft_and_storyworld",
      "acceptance": "Record typed causal evidence and falsifiable negative control for emotional declaration restraint.",
      "human_boundary": "Never claim literary merit or reader response from structural conformance alone."
    },
    {
      "id": "B008",
      "number": 8,
      "title": "Sentence-Rhythm Diversity Audit",
      "domain": "Prose Intelligence",
      "normative_text": "Evaluate fragment chains, parallel constructions, paragraph length, and narration cadence over sustained passages.",
      "origin": "carried_forward_prior_zip",
      "implementation": "existing_separate_zip_not_imported",
      "evidence_kind": "authored_specification",
      "canonical_owner": "existing_craft_and_storyworld",
      "acceptance": "Record typed causal evidence and falsifiable negative control for sentence-rhythm diversity audit.",
      "human_boundary": "Never claim literary merit or reader response from structural conformance alone."
    },
    {
      "id": "B009",
      "number": 9,
      "title": "Authorial Intrusion Detector",
      "domain": "Prose Intelligence",
      "normative_text": "Catch narration that announces a chapter's or book's intended meaning without explicit metafictional justification.",
      "origin": "carried_forward_prior_zip",
      "implementation": "existing_separate_zip_not_imported",
      "evidence_kind": "authored_specification",
      "canonical_owner": "existing_craft_and_storyworld",
      "acceptance": "Record typed causal evidence and falsifiable negative control for authorial intrusion detector.",
      "human_boundary": "Never claim literary merit or reader response from structural conformance alone."
    },
    {
      "id": "B010",
      "number": 10,
      "title": "Sensory Progression Engine",
      "domain": "Prose Intelligence",
      "normative_text": "Track recurring sensations and require evolution in cause, meaning, stakes, or consequence.",
      "origin": "carried_forward_prior_zip",
      "implementation": "existing_separate_zip_not_imported",
      "evidence_kind": "authored_specification",
      "canonical_owner": "existing_craft_and_storyworld",
      "acceptance": "Record typed causal evidence and falsifiable negative control for sensory progression engine.",
      "human_boundary": "Never claim literary merit or reader response from structural conformance alone."
    },
    {
      "id": "B011",
      "number": 11,
      "title": "Descriptive Compression Operator",
      "domain": "Prose Intelligence",
      "normative_text": "Identify redundant description while safeguarding atmosphere, orientation, voice, and character.",
      "origin": "carried_forward_prior_zip",
      "implementation": "existing_separate_zip_not_imported",
      "evidence_kind": "authored_specification",
      "canonical_owner": "existing_craft_and_storyworld",
      "acceptance": "Record typed causal evidence and falsifiable negative control for descriptive compression operator.",
      "human_boundary": "Never claim literary merit or reader response from structural conformance alone."
    },
    {
      "id": "B012",
      "number": 12,
      "title": "Prose Preservation Rule",
      "domain": "Prose Intelligence",
      "normative_text": "Forbid automatic deletion by word-frequency threshold; edits require contextual review and author approval.",
      "origin": "carried_forward_prior_zip",
      "implementation": "existing_separate_zip_not_imported",
      "evidence_kind": "authored_specification",
      "canonical_owner": "existing_craft_and_storyworld",
      "acceptance": "Record typed causal evidence and falsifiable negative control for prose preservation rule.",
      "human_boundary": "Never claim literary merit or reader response from structural conformance alone."
    },
    {
      "id": "B013",
      "number": 13,
      "title": "Escalation Novelty Law",
      "domain": "Thriller & Suspense Intelligence",
      "normative_text": "New danger beats must alter exposure, constraints, knowledge, relationships, or options; heightened adjectives alone do not qualify.",
      "origin": "carried_forward_prior_zip",
      "implementation": "existing_separate_zip_not_imported",
      "evidence_kind": "authored_specification",
      "canonical_owner": "existing_craft_and_storyworld",
      "acceptance": "Record typed causal evidence and falsifiable negative control for escalation novelty law.",
      "human_boundary": "Never claim literary merit or reader response from structural conformance alone."
    },
    {
      "id": "B014",
      "number": 14,
      "title": "Tension Plateau Detector",
      "domain": "Thriller & Suspense Intelligence",
      "normative_text": "Find adjacent scenes repeating the same pressure without a dramatic state change.",
      "origin": "carried_forward_prior_zip",